{
  "$schema": "./battle.schema.json",
  "enable_baseatk": 9,
  "enable_baseatk_renewal": 671,
  "enable_perfect_flee": 1,
  "enable_critical": 17,
  "mob_critical_rate": 100,
  "critical_rate": 100,
  "attack_walk_delay": 15,
  "pc_damage_walk_delay_rate": 20,
  "damage_walk_delay_rate": 100,
  "multihit_delay": 80,
  "player_damage_delay_rate": 100,
  "undead_detect_type": 0,
  "attribute_recover": false,
  "min_hitrate": 5,
  "max_hitrate": 100,
  "agi_penalty_type": 1,
  "agi_penalty_target": 1,
  "agi_penalty_count": 3,
  "agi_penalty_num": 10,
  "vit_penalty_type": 1,
  "vit_penalty_target": 1,
  "vit_penalty_count": 3,
  "vit_penalty_num": 5,
  "weapon_defense_type": 0,
  "magic_defense_type": 0,
  "attack_direction_change": 0,
  "attack_attr_none": 14,
  "equip_natural_break_rate": 0,
  "equip_self_break_rate": 100,
  "equip_skill_break_rate": 100,
  "delay_battle_damage": true,
  "synchronize_damage": false,
  "arrow_decrement": 1,
  "ammo_unequip": true,
  "ammo_check_weapon": true,
  "autospell_check_range": false,
  "knockback_left": true,
  "warg_can_falcon": false,
  "snap_dodge": false,
  "break_mob_equip": false
}